{
  "formatVersion": 1,
  "synthetic": true,
  "id": "bootstrap-planning",
  "contextRef": "context.json",
  "planRef": "plan.json",
  "accountingRef": "accounting.jsonl",
  "eventsRef": "events.jsonl",
  "reportRef": "report.md",
  "expectedRef": "expected.json",
  "request": {
    "attemptId": "next-attempt",
    "accountId": "cycle",
    "category": "ai",
    "purpose": "planning",
    "profileId": "economy",
    "effort": "low",
    "bounded": true,
    "reservationMicros": "10000",
    "maxInputTokens": 1000,
    "maxOutputTokens": 1000,
    "currency": "USD"
  }
}
